{
  "$schema":"https://json-schema.org/draft/2020-12/schema",
  "type":"object","additionalProperties":false,
  "required":["schema_version","sha256","queried_at","status","results","warnings"],
  "properties":{
    "schema_version":{"const":"1.0.0"},"sha256":{"type":"string","pattern":"^[0-9a-f]{64}$"},
    "queried_at":{"type":"string","pattern":"^\\d{4}-\\d{2}-\\d{2}T\\d{2}:\\d{2}:\\d{2}Z$"},"status":{"const":"complete"},
    "results":{"type":"array","minItems":1,"maxItems":32,"items":{"$ref":"#/$defs/result"}},"warnings":{"type":"array","items":{"type":"string","maxLength":1024}}
  },
  "$defs":{"result":{"type":"object","additionalProperties":false,"required":["provider","provider_version","state","confidence","labels","reason","source","first_seen","last_seen","cache"],"properties":{
    "provider":{"type":"string","pattern":"^[a-z0-9][a-z0-9.-]*$"},"provider_version":{"type":"string"},"state":{"enum":["known_benign","known_malicious","suspicious","unknown","unavailable","rate_limited","unauthorized","provider_error"]},"confidence":{"type":["string","null"]},"labels":{"type":"array","maxItems":32,"items":{"type":"string","maxLength":128}},"reason":{"type":["string","null"]},"source":{"type":["string","null"]},"first_seen":{"type":["string","null"]},"last_seen":{"type":["string","null"]},"cache":{"type":"object","additionalProperties":false,"required":["hit","stored_at","expires_at"],"properties":{"hit":{"type":"boolean"},"stored_at":{"type":["string","null"]},"expires_at":{"type":["string","null"]}}}
  }}}
}
