{"schema_version":"1.0.0","sha256":"cccccccccccccccccccccccccccccccccccccccccccccccccccccccccccccccc","queried_at":"2026-01-01T00:00:00Z","status":"complete","results":[{"provider":"local-pasol-reputation","provider_version":"0.1.0","state":"suspicious","confidence":null,"labels":["test"],"reason":"deterministic fixture","source":"fixture","first_seen":"2025-12-31T00:00:00Z","last_seen":null,"cache":{"hit":false,"stored_at":null,"expires_at":null}}],"warnings":[]}
