{"schema_version":"1.0.0","sha256":"e000000000000000000000000000000000000000000000000000000000000000","queried_at":"2026-01-01T00:00:00Z","status":"complete","results":[{"provider":"local-pasol-reputation","provider_version":"0.1.0","state":"unknown","confidence":null,"labels":[],"reason":null,"source":null,"first_seen":null,"last_seen":null,"cache":{"hit":false,"stored_at":null,"expires_at":null}}],"warnings":[]}
