{"schema_version":"1.0.0","sha256":"ffffffffffffffffffffffffffffffffffffffffffffffffffffffffffffffff","queried_at":"2026-01-01T00:00:00Z","status":"complete","results":[{"provider":"local-pasol-reputation","provider_version":"0.1.0","state":"known_benign","confidence":null,"labels":["test"],"reason":"deterministic fixture","source":"fixture","first_seen":"2025-12-31T00:00:00Z","last_seen":null,"cache":{"hit":true,"stored_at":"2026-01-01T00:00:00Z","expires_at":"2026-01-08T00:00:00Z"}}],"warnings":[]}
